{
  "name": "skills-g17-ignore-corpus",
  "family": "agent",
  "authority": "minion-agent-docs spec/harness.md WP-14.1 (HAR-001, HAR-010..HAR-013); assurance/layers/14-wp141-characterization.md",
  "pi_revision": "b7bb00b936dbe21b8e160b3e89efdec361846699",
  "requirements": [
    "HAR-001",
    "HAR-011",
    "HAR-013"
  ],
  "witnesses": [
    "skill_discovery_g17_ignore_corpus"
  ],
  "skill_discovery": {
    "fixture": [
      {
        "path": "skills/.gitignore",
        "text": "# c\n   \n*-x\n/a\n"
      },
      {
        "path": "skills/b/SKILL.md",
        "text": "---\ndescription: In b.\n---\nBody."
      },
      {
        "path": "skills/a/c/SKILL.md",
        "text": "---\ndescription: In a/c.\n---\nBody."
      },
      {
        "path": "skills/root.md",
        "text": "---\nname: skills\ndescription: Root.\n---\nBody."
      }
    ],
    "roots": [
      "skills"
    ],
    "expect": {
      "skills": [
        {
          "name": "b",
          "description": "In b.",
          "content": "Body.",
          "path": "skills/b/SKILL.md",
          "disable_model_invocation": false
        },
        {
          "name": "skills",
          "description": "Root.",
          "content": "Body.",
          "path": "skills/root.md",
          "disable_model_invocation": false
        }
      ],
      "diagnostics": []
    }
  }
}
