{
  "name": "skills-g18-ignore-corpus",
  "family": "agent",
  "authority": "minion-agent-docs spec/harness.md WP-14.1 (HAR-001, HAR-010..HAR-013); assurance/layers/14-wp141-characterization.md",
  "pi_revision": "b7bb00b936dbe21b8e160b3e89efdec361846699",
  "requirements": [
    "HAR-001",
    "HAR-011",
    "HAR-013"
  ],
  "witnesses": [
    "skill_discovery_g18_ignore_corpus"
  ],
  "skill_discovery": {
    "fixture": [
      {
        "path": "skills/.gitignore",
        "text": "a/b/\n**/c/\n"
      },
      {
        "path": "skills/a/SKILL.md",
        "text": "---\ndescription: In a.\n---\nBody."
      },
      {
        "path": "skills/sub/b/SKILL.md",
        "text": "---\ndescription: In sub/b.\n---\nBody."
      },
      {
        "path": "skills/a-x/SKILL.md",
        "text": "---\ndescription: In a-x.\n---\nBody."
      },
      {
        "path": "skills/x/b/SKILL.md",
        "text": "---\ndescription: In x/b.\n---\nBody."
      },
      {
        "path": "skills/root.md",
        "text": "---\nname: skills\ndescription: Root.\n---\nBody."
      }
    ],
    "roots": [
      "skills"
    ],
    "expect": {
      "skills": [
        {
          "name": "a",
          "description": "In a.",
          "content": "Body.",
          "path": "skills/a/SKILL.md",
          "disable_model_invocation": false
        },
        {
          "name": "a-x",
          "description": "In a-x.",
          "content": "Body.",
          "path": "skills/a-x/SKILL.md",
          "disable_model_invocation": false
        },
        {
          "name": "skills",
          "description": "Root.",
          "content": "Body.",
          "path": "skills/root.md",
          "disable_model_invocation": false
        },
        {
          "name": "b",
          "description": "In sub/b.",
          "content": "Body.",
          "path": "skills/sub/b/SKILL.md",
          "disable_model_invocation": false
        },
        {
          "name": "b",
          "description": "In x/b.",
          "content": "Body.",
          "path": "skills/x/b/SKILL.md",
          "disable_model_invocation": false
        }
      ],
      "diagnostics": []
    }
  }
}
