{
  "name": "skills-i07-globstar-and-root-file-patterns",
  "family": "agent",
  "authority": "minion-agent-docs spec/harness.md WP-14.1 (HAR-001, HAR-010..HAR-013); assurance/layers/14-wp141-characterization.md",
  "pi_revision": "b7bb00b936dbe21b8e160b3e89efdec361846699",
  "requirements": [
    "HAR-001",
    "HAR-011",
    "HAR-013"
  ],
  "witnesses": [
    "skill_discovery_i07_globstar_and_root_file_patterns"
  ],
  "skill_discovery": {
    "fixture": [
      {
        "path": "skills/.gitignore",
        "text": "**/drop\n*.md\n!keep.md\n"
      },
      {
        "path": "skills/x/drop/SKILL.md",
        "text": "---\nname: drop\ndescription: Use drop.\n---\nBody."
      },
      {
        "path": "skills/x/kept/SKILL.md",
        "text": "---\nname: kept\ndescription: Use kept.\n---\nBody."
      },
      {
        "path": "skills/gone.md",
        "text": "---\nname: gone\ndescription: Use gone.\n---\nBody."
      },
      {
        "path": "skills/keep.md",
        "text": "---\nname: skills\ndescription: Use skills.\n---\nBody."
      }
    ],
    "roots": [
      "skills"
    ],
    "expect": {
      "skills": [
        {
          "name": "skills",
          "description": "Use skills.",
          "content": "Body.",
          "path": "skills/keep.md",
          "disable_model_invocation": false
        }
      ],
      "diagnostics": []
    }
  }
}
