{
  "name": "skills-g02-ignore-corpus",
  "family": "agent",
  "authority": "minion-agent-docs spec/harness.md WP-14.1 (HAR-001, HAR-010..HAR-013); assurance/layers/14-wp141-characterization.md",
  "pi_revision": "b7bb00b936dbe21b8e160b3e89efdec361846699",
  "requirements": [
    "HAR-001",
    "HAR-011",
    "HAR-013"
  ],
  "witnesses": [
    "skill_discovery_g02_ignore_corpus"
  ],
  "skill_discovery": {
    "fixture": [
      {
        "path": "skills/.gitignore",
        "text": "?b\na/*\n\n"
      },
      {
        "path": "skills/sub/.gitignore",
        "text": "a/**\n"
      },
      {
        "path": "skills/a/b/SKILL.md",
        "text": "---\ndescription: In a/b.\n---\nBody."
      },
      {
        "path": "skills/#x/SKILL.md",
        "text": "---\ndescription: In #x.\n---\nBody."
      },
      {
        "path": "skills/B/SKILL.md",
        "text": "---\ndescription: In B.\n---\nBody."
      },
      {
        "path": "skills/a/SKILL.md",
        "text": "---\ndescription: In a.\n---\nBody."
      },
      {
        "path": "skills/keep.md",
        "text": "---\nname: skills\ndescription: Keep.\n---\nBody."
      }
    ],
    "roots": [
      "skills"
    ],
    "expect": {
      "skills": [
        {
          "name": "#x",
          "description": "In",
          "content": "Body.",
          "path": "skills/#x/SKILL.md",
          "disable_model_invocation": false
        },
        {
          "name": "B",
          "description": "In B.",
          "content": "Body.",
          "path": "skills/B/SKILL.md",
          "disable_model_invocation": false
        },
        {
          "name": "skills",
          "description": "Keep.",
          "content": "Body.",
          "path": "skills/keep.md",
          "disable_model_invocation": false
        }
      ],
      "diagnostics": [
        {
          "code": "invalid_metadata",
          "path": "skills/#x/SKILL.md",
          "message": "name contains invalid characters (must be lowercase a-z, 0-9, hyphens only)"
        },
        {
          "code": "invalid_metadata",
          "path": "skills/B/SKILL.md",
          "message": "name contains invalid characters (must be lowercase a-z, 0-9, hyphens only)"
        }
      ]
    }
  }
}
