{
  "name": "skills-g33-ignore-corpus",
  "family": "agent",
  "authority": "minion-agent-docs spec/harness.md WP-14.1 (HAR-001, HAR-010..HAR-013); assurance/layers/14-wp141-characterization.md",
  "pi_revision": "b7bb00b936dbe21b8e160b3e89efdec361846699",
  "requirements": [
    "HAR-001",
    "HAR-011",
    "HAR-013"
  ],
  "witnesses": [
    "skill_discovery_g33_ignore_corpus"
  ],
  "skill_discovery": {
    "fixture": [
      {
        "path": "skills/.gitignore",
        "text": "b/\nkeep\n"
      },
      {
        "path": "skills/sub/.gitignore",
        "text": "a b\n"
      },
      {
        "path": "skills/sub/b/SKILL.md",
        "text": "---\ndescription: In sub/b.\n---\nBody."
      },
      {
        "path": "skills/sub/c/SKILL.md",
        "text": "---\ndescription: In sub/c.\n---\nBody."
      },
      {
        "path": "skills/c/SKILL.md",
        "text": "---\ndescription: In c.\n---\nBody."
      },
      {
        "path": "skills/B/SKILL.md",
        "text": "---\ndescription: In B.\n---\nBody."
      },
      {
        "path": "skills/root.md",
        "text": "---\nname: skills\ndescription: Root.\n---\nBody."
      },
      {
        "path": "skills/keep.md",
        "text": "---\nname: skills\ndescription: Keep.\n---\nBody."
      }
    ],
    "roots": [
      "skills"
    ],
    "expect": {
      "skills": [
        {
          "name": "c",
          "description": "In c.",
          "content": "Body.",
          "path": "skills/c/SKILL.md",
          "disable_model_invocation": false
        },
        {
          "name": "skills",
          "description": "Keep.",
          "content": "Body.",
          "path": "skills/keep.md",
          "disable_model_invocation": false
        },
        {
          "name": "skills",
          "description": "Root.",
          "content": "Body.",
          "path": "skills/root.md",
          "disable_model_invocation": false
        },
        {
          "name": "c",
          "description": "In sub/c.",
          "content": "Body.",
          "path": "skills/sub/c/SKILL.md",
          "disable_model_invocation": false
        }
      ],
      "diagnostics": []
    }
  }
}
