{
  "name": "skills-g19-ignore-corpus",
  "family": "agent",
  "authority": "minion-agent-docs spec/harness.md WP-14.1 (HAR-001, HAR-010..HAR-013); assurance/layers/14-wp141-characterization.md",
  "pi_revision": "b7bb00b936dbe21b8e160b3e89efdec361846699",
  "requirements": [
    "HAR-001",
    "HAR-011",
    "HAR-013"
  ],
  "witnesses": [
    "skill_discovery_g19_ignore_corpus"
  ],
  "skill_discovery": {
    "fixture": [
      {
        "path": "skills/.gitignore",
        "text": "[ab]\n"
      },
      {
        "path": "skills/c/SKILL.md",
        "text": "---\ndescription: In c.\n---\nBody."
      }
    ],
    "roots": [
      "skills"
    ],
    "expect": {
      "skills": [
        {
          "name": "c",
          "description": "In c.",
          "content": "Body.",
          "path": "skills/c/SKILL.md",
          "disable_model_invocation": false
        }
      ],
      "diagnostics": []
    }
  }
}
