{
  "name": "skills-g21-ignore-corpus",
  "family": "agent",
  "authority": "minion-agent-docs spec/harness.md WP-14.1 (HAR-001, HAR-010..HAR-013); assurance/layers/14-wp141-characterization.md",
  "pi_revision": "b7bb00b936dbe21b8e160b3e89efdec361846699",
  "requirements": [
    "HAR-001",
    "HAR-011",
    "HAR-013"
  ],
  "witnesses": [
    "skill_discovery_g21_ignore_corpus"
  ],
  "skill_discovery": {
    "fixture": [
      {
        "path": "skills/.gitignore",
        "text": "?b\n**/c/\n"
      },
      {
        "path": "skills/!keep/SKILL.md",
        "text": "---\ndescription: In !keep.\n---\nBody."
      },
      {
        "path": "skills/sub/b/SKILL.md",
        "text": "---\ndescription: In sub/b.\n---\nBody."
      },
      {
        "path": "skills/root.md",
        "text": "---\nname: skills\ndescription: Root.\n---\nBody."
      }
    ],
    "roots": [
      "skills"
    ],
    "expect": {
      "skills": [
        {
          "name": "!keep",
          "description": "In !keep.",
          "content": "Body.",
          "path": "skills/!keep/SKILL.md",
          "disable_model_invocation": false
        },
        {
          "name": "skills",
          "description": "Root.",
          "content": "Body.",
          "path": "skills/root.md",
          "disable_model_invocation": false
        },
        {
          "name": "b",
          "description": "In sub/b.",
          "content": "Body.",
          "path": "skills/sub/b/SKILL.md",
          "disable_model_invocation": false
        }
      ],
      "diagnostics": [
        {
          "code": "invalid_metadata",
          "path": "skills/!keep/SKILL.md",
          "message": "name contains invalid characters (must be lowercase a-z, 0-9, hyphens only)"
        }
      ]
    }
  }
}
