{
  "name": "skills-i04-case-insensitive",
  "family": "agent",
  "authority": "minion-agent-docs spec/harness.md WP-14.1 (HAR-001, HAR-010..HAR-013); assurance/layers/14-wp141-characterization.md",
  "pi_revision": "b7bb00b936dbe21b8e160b3e89efdec361846699",
  "requirements": [
    "HAR-001",
    "HAR-011",
    "HAR-013"
  ],
  "witnesses": [
    "skill_discovery_i04_case_insensitive"
  ],
  "skill_discovery": {
    "fixture": [
      {
        "path": "skills/.gitignore",
        "text": "Secret\n"
      },
      {
        "path": "skills/secret/SKILL.md",
        "text": "---\nname: secret\ndescription: Use secret.\n---\nBody."
      },
      {
        "path": "skills/public/SKILL.md",
        "text": "---\nname: public\ndescription: Use public.\n---\nBody."
      }
    ],
    "roots": [
      "skills"
    ],
    "expect": {
      "skills": [
        {
          "name": "public",
          "description": "Use public.",
          "content": "Body.",
          "path": "skills/public/SKILL.md",
          "disable_model_invocation": false
        }
      ],
      "diagnostics": []
    }
  }
}
